{
  "schema_version": 1,
  "status": "passed",
  "command": "make integration-p03",
  "started_at": "2026-09-19T18:53:29Z",
  "finished_at": "2026-09-19T18:53:41Z",
  "source": {
    "repository": "https://github.com/otuschhoff/rados-go.git",
    "repository_commit": "6f8abc72472cc3eb039349b6083928de7a1937b2",
    "dirty": true,
    "identity": "content-addressed-artifacts",
    "artifacts": {
      "go.mod": "82c5d6809f3e77a2b68f41462004584d9399946795a90c97654439bff5ab5cdb",
      "go.sum": "aada9d87cdf1fc9761055ae34522bdc35421d952dcc19d6f5323dd2dc087333c",
      "integration/p03/legacy-crush.txt": "5b07d221477e01a50ad37ab113cb8511ada2895bd3e848504518d0ef634f13ea",
      "integration/p03/probe/main.go": "898b974ee575d1d1a51ecdac5c8abd51dd6ad3f9506c418371d15b1aeb1c842e",
      "integration/p03/report.schema.json": "a402b69c0522220ad8f32aa7ea6c19e3e285106f20451e674574b2ef796fd9be",
      "integration/p03/reproduce.sh": "afc999ecc5b195ec93ba8c75487b16f5dc217ae9767df64fff35cb4771fced57",
      "internal/cephx/connector.go": "0300251fb70087691876d14571aa44e684bf8a8e3c6b4e39866bd6ca209c875c",
      "internal/cephx/connector_test.go": "e351fc0a647111a226951c46b0506542cc4902a42e3e55d693b9f8d7447c6d37",
      "internal/cephx/core.go": "ad393c2a60c0067acb68afa68bfd09d876b11d968a58ab80840c0bb556af1d7b",
      "internal/cephx/core_test.go": "c0349e6dd460b15c86ea32e100c7908fe3461708027fccfe4cba35feb0bff2f5",
      "internal/cephx/credentials.go": "50e51d3d0db50dc9a979f4a3c95747fdf4777b79c0e619e1b6d8702253488255",
      "internal/cephx/credentials_test.go": "f44c53c9253881f630c98345219516f61dd33a501aff74a5039827ccec9dce53",
      "internal/cephx/fixture_test.go": "a59892b95c406ca6bb9ed77f0c4f428b5901330604b3c38e08f670a540f0e0d5",
      "internal/cephx/fuzz_test.go": "987b6da5615ac292e35d14b5d30e02b9711c1870f8ab58d0480da09046825b65",
      "internal/cephx/instance_id_test.go": "8a11c290c3c8837bc28fa8ad91a1c40c69f075707fb7e2b0602d7dac37270a9a",
      "internal/cephx/receive_budget_test.go": "793311990d2e766ae918f453c997288d29c6a5c32214c2290c9418a66152f362",
      "internal/cephx/service_connector.go": "ec6169db8f38420f6770f21012ba2d1420045984185d85c67f125b32ec422884",
      "internal/cephx/service_connector_test.go": "c963139bc2e8cd7c85290c729e526a5119cb02cd57e152d4f65f59edec54f4db",
      "internal/encoding/codec.go": "3f03d3783293a49d5de4986f28c615532cc54722fd5d4797448f883b683de550",
      "internal/encoding/codec_benchmark_test.go": "5ecc7c8ba2a14c8baf9917d8e39e3c294f6d141a99e8438ba7d7e729cba6784c",
      "internal/encoding/codec_test.go": "ac3316834d1f0bb1bb2633f5c777c70b082f55bd3a14057f5e14772039cbcfc5",
      "internal/encoding/crc.go": "9dce38e0846c80679a7182baeca6d4bd44a853b0a7841a507caa0a46675e9938",
      "internal/encoding/ownership_test.go": "83a7fc42a923faaea2eaae672c8ef659145681075b582f14001e5343a93606a2",
      "internal/msgr/banner.go": "46a374d27b4e24422d830c848541d56baad74dd13417653a02c1a6c0e1010527",
      "internal/msgr/banner_test.go": "0a956f1034ae80002a691504404dbc938356741ba7f182f502f34f47227af859",
      "internal/msgr/control.go": "2d205b3fb5ddb4df7f856592b528fa4932ffc1b122ff65ea4da52a1390ea24df",
      "internal/msgr/control_test.go": "212a88dbf2d14333bd722783c517d3d3b62554ba703555aa9cedbc5d49383b88",
      "internal/msgr/fixture_test.go": "1b1b0c9514c2aa4546eef1533180f7d19a8274af4c3594f34c0b36c33864f844",
      "internal/msgr/frame.go": "fb1080a71bfbff876785ab96dd0a629d588a32e052b3084586dbe5aedad66eed",
      "internal/msgr/frame_test.go": "82cb5c5e6d1304856c8458dd2fb5d7dd2e5bb5590b1e589a7e538aaa993350d2",
      "internal/msgr/fuzz_test.go": "0c6e17f14f7bbed9daf1d02040b35dc6a5f770a07c847462f43c58d08a16405c",
      "internal/msgr/message.go": "9c5269dd3ab9221e2168043ff668278b5dba585239e5b36b523b58941b1485ee",
      "internal/msgr/message_test.go": "b8f39d1b427df9ae87af257f2c1d36c2d51bc0d6b39ad015a4d97e97ab439870",
      "internal/msgr/mode_diagnostic.go": "73721764e277d66b38a7c876e8f3962a6a3e9a1169b88b3cd1ba7ac990bc6aec",
      "internal/msgr/mode_diagnostic_test.go": "687eb3bbdca2529e7c7800a03945550513c87aca562daae3231c374a58b08026",
      "internal/msgr/performance_baseline_test.go": "c63b2f723e46906b58cc4b1150309050ff07439f59543fbd9b95fcb4978749dd",
      "internal/msgr/phase4_budgeted_capture_test.go": "7a304f7e35aab050810df60b0c4aa03fb108bbd22d1b6d5e97aa6d3e358e6743",
      "internal/msgr/phase4_resource_test.go": "dd53030dbd8dc8db40ba34cde178afbdb10611c26957fc24b54de01f8b8ef0a2",
      "internal/msgr/phase4_stalled_test.go": "d33b5953e5f218c9074eb0207eb57d395f70017fc1662a2a8696d03cf584d148",
      "internal/msgr/queue_burst_benchmark_test.go": "78392e0a1b9dda766a97b057de9e09d51518772a5a692f6c06178f19888889fb",
      "internal/msgr/reader_retirement_test.go": "58d83510d1f47f7cb405436a5f6d1cb826744c28d271aa80f46ee77387023bec",
      "internal/msgr/receive_budget.go": "b11a0553f11cca97a7c8c92e132fd34ff6d2708dfe3177ca5e31cf312c81accc",
      "internal/msgr/receive_budget_benchmark_test.go": "35eec2babdc2db1800883c9be2dfdeef62b38d14ae36adf848ba249b65732d48",
      "internal/msgr/receive_budget_codec_test.go": "6799c9ddd1b50391afb74dec38fafe0b5729d6e73787438ca60551be9e3fe641",
      "internal/msgr/receive_budget_lifecycle_test.go": "1503b65254f5bb6a40beefa4729e7601ee441018c03b53d3f09ceacdff59b9de",
      "internal/msgr/receive_budget_stress_test.go": "12a91c113460bdf9309bd4e55eed2e33f067190970a51729f6b4e951fdd18e41",
      "internal/msgr/receive_budget_test.go": "535deea3dfaef45c553ef8beacca8242e22ac34ea182bddcea58c73fbef57517",
      "internal/msgr/receive_into_benchmark_test.go": "14fc934c61de63f9108af3189a7ab40a688a82a1eba21816d839cff502c44eba",
      "internal/msgr/receive_scratch.go": "9fb863409ddd418c02d02eccb2a17a5c6ab1ca7e8de2a9642164148bcdba7ddb",
      "internal/msgr/receive_scratch_inventory_test.go": "fd5fd60090e8192bc5b79d40e17e9820f185d2ad7ee521f5b33879235aa89d2a",
      "internal/msgr/receive_scratch_test.go": "7d47499324526b5b96ca87df72a2efdaa4312e568b16b1d686e314c1f0f93f31",
      "internal/msgr/reply_borrow_test.go": "21c2500038f4431271a3da35c683868d72f296dea824e6555ec807af67c7c455",
      "internal/msgr/request_timing.go": "05aadc5ed79ec08eb8b4ae059aeae2327537edd6c47e021762c4bbcee6dfdc93",
      "internal/msgr/request_timing_test.go": "cfa40e450c219276376a92cec47218efac7fc9bad9434e9e468d4e058b32d9cc",
      "internal/msgr/secure.go": "8eea7b17b46d48072ec02cb82a1cc1da758ffaaed6a38d4c3bab4801fce09103",
      "internal/msgr/secure_benchmark_test.go": "fc0ee1f7f321c26c63b0bbc79e99e05b826bc95c0952c82a265462b2511dfbec",
      "internal/msgr/secure_test.go": "fc1f49e7298800dcef0bcdf93bd2f3332d482f0127679eb1b5f6545b1791140f",
      "internal/msgr/session.go": "df78cf38e40eb07e130d898ba42bec9d1b4d967709f382aee6152da0e529596e",
      "internal/msgr/session_control.go": "376f0399242987a764378ebf521137c75991e3ed33b7318bc9ba6c6c410f48f0",
      "internal/msgr/session_control_test.go": "440d271758f3b537964e4a8cce50d90a7e4e7c8336bb835cf952b573f0b33d6d",
      "internal/msgr/session_ownership_test.go": "74b7030ff2c87394396cf37306073ee272f0e024707731393a1b692f3c80ddc9",
      "internal/msgr/session_queue_benchmark_test.go": "026135e21744481b71d0ff652ed12830685d36e80fcbff054c03f24f4b7e4841",
      "internal/msgr/session_queue_test.go": "3c592525d720fdc76ecc3ec30db52014675799d888c22c945c19687687227131",
      "internal/msgr/session_receive_test.go": "b03ed2d56aab19bff15264f41f3fc60abb904f85ae6c5060b597e11b4d94d4cf",
      "internal/msgr/session_renewal_test.go": "09351cea1f3c548dd269ee9d080f26feda253e0c1b825f6a265b960dcd86bec9",
      "internal/msgr/session_retention_test.go": "7413225fb5ce68b9a72d4ea43d3b3a637bbe2d02e01f030f3a0418bcfe691ae2",
      "internal/msgr/session_test.go": "9a21c12b2894fc6ff062a4e6b9160f46440193891842c84c3d2ef9d0d2d48a1e",
      "internal/msgr/transport.go": "e4f73f4a7b595f67ec4f2b358621e1ed99a49056a4aae3d108c565ee81d3d7a5",
      "internal/msgr/transport_test.go": "db3b6f93c68a5fbce4eb180b987051d4e38429dd86a921fe9b1ed26183571a8c",
      "internal/protocol/address.go": "802b49d86bda957c9f243ef9b619a57f49441b108b0e69cf8c814cbb4eb5c686",
      "internal/protocol/entity.go": "bae43654cc37194c84ce1be63ef071aa1dac6050c68c012b969ef797b6f48b01",
      "internal/protocol/errno.go": "853b8360670a28e8462d6e2eeb3c7d427e9dacf98fe9752b5da2bfad71baafcd",
      "internal/protocol/features.go": "1031cd9b04982627ed180d948c4f0961f0afeff01d3dfc6aa1ed1b6c951b415e",
      "internal/protocol/message_types.go": "57f3a95b49e8e4002a91ec99206f703cedd38aa86d12911c52ad1a8ea2169fe6",
      "internal/protocol/message_types_test.go": "2d4397612a4ac944ee1442e719718ecf387b84ceed5a68290e96f49289bb89b1",
      "internal/protocol/protocol_test.go": "2fd9418c3c3f6324ca9b65350b1857c990d89c9a184c0e91f0072d26f956ce68"
    }
  },
  "server": {
    "repository": "https://github.com/ceph/ceph.git",
    "source_anchor_commit": "7f793731f1b39eb4f465e960113d2363c311b964",
    "image": "quay.io/ceph/ceph@sha256:6e6bc7b28fa1b334108a3646af5533dfb50db508efdf5b358eb7dd0dd37a48aa",
    "platform": "linux/arm64",
    "host_platform": "linux/arm64",
    "runtime_package": "ceph-mon-20.2.4-0.el9",
    "monitor_binary_sha256": "4b44a5660fdcc6bf7701f64fa41f707b8ff619d09042219d071e6d9ac45ab81b"
  },
  "scenarios": {
    "secure_authentication": "passed",
    "client_server_ident": "passed",
    "same_session_renewal": "passed",
    "global_id_reuse": "passed",
    "ticket_renewal": "passed",
    "expired_ticket_rejection": "passed",
    "post_expiry_reconnect": "passed",
    "valid_wrong_key_rejection": "passed",
    "secure_to_crc_downgrade_rejection": "passed"
  },
  "probe": {
    "authenticated_mode": "secure",
    "global_id": 4099,
    "reconnected": true,
    "ticket_renewed": true,
    "initial_ticket_sha256": "2fa8f5094560fec91903012ff6f2e547c6a7decd04a340b0f3d3b24e3bd3386a",
    "renewed_ticket_sha256": "bbf621f70f1e13d20ce78999aff33a8a46cfa0800287dfe515cf812ceedf0d61",
    "expiry_rejected": true,